{"envelope_version":"1.0.0","algorithm":"Ed25519","key_id":"guardian.status-v1","payload":"eyJwcm90b2NvbF92ZXJzaW9uIjoiMS4wLjAiLCJpbnN0YW5jZV9pZCI6ImNpLXByZXZpZXctZ3VhcmRpYW4iLCJtb2RlIjoib2ZmbGluZSIsInNlcXVlbmNlIjoyLCJjaGFuZ2VkX2F0IjoiMjAyNi0wOC0xOVQyMjo0Mjo1MS43MTk2MzE0MTFaIiwicmVhc29uX2NvZGUiOiJvd25lci5wdWJsaWNfcHJldmlld19maXh0dXJlIiwicHJldmlvdXNfcmVjZWlwdF9oYXNoIjoic2hhMjU2OjE0NWIyYjBhNmU4OGNhZWQ1ODAxMmUxMjIyNjM4NzE1NTM2ZTNlZWVkODc3ZGNkZTkyMDQ5ZDkyNTY5NDA1Y2MifQ","signature":"AKNOHG_dGFk4wNEpfvIXcsJrdAAfURKjpbCNIUsQ0US34bCwS8xOYesYzQHo182O1g02rmPgp99FAg19QEJZAA"}
